{
  "run_id": "run_99123b751cc6",
  "mode": "analyze",
  "generated_at": "2026-03-10T09:56:24.965673+00:00",
  "status": "ok",
  "failure_count": 0,
  "fatal_failure_count": 1,
  "retryable_failure_count": 0,
  "degradable_count": 0,
  "report_json": "/Users/hzz/workspace/sql-optimizer-skill/test-files/mybatis-test/runs/run_99123b751cc6/report.json"
}
