{
  "run_id": "run_supervisor_optimize_report_81be33f1",
  "mode": "analyze",
  "generated_at": "2026-03-30T13:22:57.617107+00:00",
  "status": "ok",
  "failure_count": 0,
  "fatal_failure_count": 3,
  "retryable_failure_count": 0,
  "degradable_count": 0,
  "report_json": "/Users/klaus/Desktop/sql-optimizer-skill/tests/harness/tests/fixtures/project/runs/run_supervisor_optimize_report_81be33f1/overview/report.json"
}
